[
  {"activity_id":"A-L0303-1","lesson_id":"L-03-03","activity_type":"compare_choice","purpose":"Map standard/local/third-party imports, active environments, file paths, environment secrets, and HTTP request/response parts.","interaction_mode":"guided","source_dependency":"source_required","estimated_minutes":18,"input_contract":"Learner predicts four environment and API choices before revealing explanations.","output_contract":"Learner scores 4/4 on retrieval and explains why package installation and import are separate steps.","captures_note":true,"captures_confidence":true,"captures_needs_review":true,"status":"review"},
  {"activity_id":"A-L0303-2","lesson_id":"L-03-03","activity_type":"guided_code","purpose":"Read JSON config, retrieve an environment-backed secret, construct a request plan, and print a redacted summary.","interaction_mode":"guided","source_dependency":"bridge_allowed","estimated_minutes":22,"input_contract":"Learner completes starter_primary.py without hardcoding a token or making a network call.","output_contract":"Primary validator passes 10/10 including hidden-config and redaction probes.","captures_note":false,"captures_confidence":true,"captures_needs_review":true,"status":"review"},
  {"activity_id":"A-L0303-3","lesson_id":"L-03-03","activity_type":"checkpoint","purpose":"Transfer the client bridge to a different config path, secret name, endpoint, and body.","interaction_mode":"adaptive","source_dependency":"learner_state_driven","estimated_minutes":22,"input_contract":"Learner completes starter_transfer.py closed-note before hints.","output_contract":"Transfer validator passes 10/10 and missing-secret behavior remains safe.","captures_note":false,"captures_confidence":true,"captures_needs_review":true,"status":"review"}
]
