[
{"activity_id":"A-L0601-1","lesson_id":"L-06-01","activity_type":"self_explanation","purpose":"Build an evidence ledger for every current AI-901 objective.","interaction_mode":"guided","source_dependency":"source_required","estimated_minutes":25,"input_contract":"Learner has completed all prerequisite lesson packages.","output_contract":"All 15 objectives receive ready, remediate, or not-yet-assessed status with specific evidence; confidence alone is rejected.","captures_note":true,"captures_confidence":true,"captures_needs_review":true,"status":"review"},
{"activity_id":"A-L0601-2","lesson_id":"L-06-01","activity_type":"checkpoint","purpose":"Identify objectives from primary and transfer evidence scenarios without notes.","interaction_mode":"adaptive","source_dependency":"learner_state_driven","estimated_minutes":30,"input_contract":"Learner receives one course-authored scenario per objective in each form.","output_contract":"Learner identifies the objective and the evidence that proves the tested skill for all 15 scenarios.","captures_note":true,"captures_confidence":true,"captures_needs_review":true,"status":"review"}
]
