[
{"activity_id":"A-L0403-1","lesson_id":"L-04-03","activity_type":"compare_choice","purpose":"Contrast analysis of existing images, multimodal visual prompting, image generation, and video generation by input and requested output.","interaction_mode":"guided","source_dependency":"source_required","estimated_minutes":18,"input_contract":"Learner predicts workload and evidence for four worked contrasts.","output_contract":"Learner retrieves all four patterns without using scenario topic as the deciding signal.","captures_note":true,"captures_confidence":true,"captures_needs_review":true,"status":"review"},
{"activity_id":"A-L0403-2","lesson_id":"L-04-03","activity_type":"checkpoint","purpose":"Apply visual workload choices and trace media input validation plus analysis-versus-generation output handling.","interaction_mode":"adaptive","source_dependency":"learner_state_driven","estimated_minutes":27,"input_contract":"Learner completes primary closed-note, remediates misses, then completes unseen transfer.","output_contract":"Validator records decision/reason correctness without retaining media, prompts, or service bodies.","captures_note":false,"captures_confidence":true,"captures_needs_review":true,"status":"review"}
]
