[
  {"activity_id":"A-L0506-1","lesson_id":"L-05-06","activity_type":"compare_choice","purpose":"Choose image analysis, multimodal visual prompting, or image generation from the required input and output.","interaction_mode":"guided","source_dependency":"source_required","estimated_minutes":15,"input_contract":"Learner has completed the visual-workload prerequisite.","output_contract":"Learner selects the smallest sufficient capability and states whether existing media is interpreted or new media is generated.","captures_note":true,"captures_confidence":true,"captures_needs_review":true,"status":"review"},
  {"activity_id":"A-L0506-2","lesson_id":"L-05-06","activity_type":"checkpoint","purpose":"Trace a safe offline visual client pattern through configuration, media validation, result handling, provenance, and action review.","interaction_mode":"adaptive","source_dependency":"learner_state_driven","estimated_minutes":20,"input_contract":"Learner receives a bounded scenario, simulated configuration, media metadata, and result state.","output_contract":"Learner identifies capability, request contract, result shape, provenance requirement, and prohibited external action.","captures_note":true,"captures_confidence":true,"captures_needs_review":true,"status":"review"}
]
