[
{"activity_id":"A-L0404-1","lesson_id":"L-04-04","activity_type":"compare_choice","purpose":"Distinguish schema-driven extraction across documents/forms, images, audio, and video from generic analysis or summarization.","interaction_mode":"guided","source_dependency":"source_required","estimated_minutes":18,"input_contract":"Learner predicts modality, requested fields, and output shape for worked contrasts.","output_contract":"Learner retrieves all four modality patterns and the analysis-versus-extraction contrast.","captures_note":true,"captures_confidence":true,"captures_needs_review":true,"status":"review"},
{"activity_id":"A-L0404-2","lesson_id":"L-04-04","activity_type":"checkpoint","purpose":"Apply modality choices and protect structured output with field schemas and missing-value/evidence safeguards.","interaction_mode":"adaptive","source_dependency":"learner_state_driven","estimated_minutes":27,"input_contract":"Learner completes primary closed-note, remediates misses, then completes unseen transfer.","output_contract":"Validator records decision/reason correctness without storing source media or extracted field values.","captures_note":false,"captures_confidence":true,"captures_needs_review":true,"status":"review"}
]
