[
{"activity_id":"A-L0501-1","lesson_id":"L-05-01","activity_type":"portal_step","purpose":"Build a durable access-project-model-deployment-interaction mental map from the current official quickstart.","interaction_mode":"guided","source_dependency":"source_required","estimated_minutes":18,"input_contract":"Learner predicts the next safe checkpoint before revealing each step.","output_contract":"Learner orders the eight workflow checkpoints and names each artifact produced.","captures_note":true,"captures_confidence":true,"captures_needs_review":true,"status":"review"},
{"activity_id":"A-L0501-2","lesson_id":"L-05-01","activity_type":"compare_choice","purpose":"Contrast model versus deployment, project endpoint versus credential, and test interaction versus production validation.","interaction_mode":"guided","source_dependency":"source_required","estimated_minutes":15,"input_contract":"Learner resolves four high-risk portal contrasts.","output_contract":"Learner explains why each tempting neighboring choice is unsafe or incomplete.","captures_note":true,"captures_confidence":true,"captures_needs_review":true,"status":"review"},
{"activity_id":"A-L0501-3","lesson_id":"L-05-01","activity_type":"checkpoint","purpose":"Apply the portal workflow to primary and troubleshooting transfer scenarios.","interaction_mode":"adaptive","source_dependency":"learner_state_driven","estimated_minutes":22,"input_contract":"Learner completes primary closed-note, remediates, then completes transfer.","output_contract":"Validator records decision/reason correctness without storing tenant, subscription, endpoint, deployment, or prompt data.","captures_note":false,"captures_confidence":true,"captures_needs_review":true,"status":"review"}
]
