[
{"activity_id":"A-L0602-1","lesson_id":"L-06-02","activity_type":"note_capture","purpose":"Convert objective-ledger misses into precise evidence gaps and source-backed remediation routes.","interaction_mode":"guided","source_dependency":"learner_state_driven","estimated_minutes":18,"input_contract":"Learner supplies objective status and dimension-level misses, not private notes or exam item text.","output_contract":"Every weak objective has gap, priority, mapped lesson, official source, practice, reassessment, and stop rule.","captures_note":true,"captures_confidence":true,"captures_needs_review":true,"status":"review"},
{"activity_id":"A-L0602-2","lesson_id":"L-06-02","activity_type":"checkpoint","purpose":"Choose safe remediation actions for unseen weak-area patterns.","interaction_mode":"adaptive","source_dependency":"source_required","estimated_minutes":18,"input_contract":"Learner receives de-identified objective evidence and attempt history.","output_contract":"Learner selects the correct evidence gap, route, practice, fresh retest, and claim/action safeguard.","captures_note":true,"captures_confidence":true,"captures_needs_review":true,"status":"review"}
]
